{
  "@id": "https://api.weather.gov/resource/example",
  "@type": "wx:Zone",
  "name": "Example Name",
  "effectiveDate": "2026-05-03T14:30:00Z",
  "expirationDate": "2026-05-03T14:30:00Z",
  "forecastOffice": "https://api.weather.gov/resource/example",
  "gridIdentifier": "example-value",
  "awipsLocationIdentifier": "example-value",
  "cwa": [
    null
  ],
  "forecastOffices": [
    "https://api.weather.gov/resource/example"
  ],
  "timeZone": [
    "NWZ001",
    "NWZ001"
  ],
  "observationStations": [
    "https://api.weather.gov/resource/example"
  ]
}